{
  "title": "Test Execution Results",
  "project": "Test Case Manager - Verification Results",
  "test_date": "2026-03-20T06:06:38.126846Z",
  "test_results": [
    {
      "test_case_id": "TEST_SUCCESS_001",
      "description": "Successful execution scenario with 3 passing steps in 1 sequence",
      "sequences": [
        {
          "sequence_id": 1,
          "name": "Successful Command Sequence",
          "step_results": [
            {
              "Pass": {
                "step": 1,
                "description": "Echo a greeting message",
                "requirement": "TEST_SUCCESS",
                "item": 1,
                "tc": 1
              }
            },
            {
              "Pass": {
                "step": 2,
                "description": "Echo a status message",
                "requirement": "TEST_SUCCESS",
                "item": 1,
                "tc": 1
              }
            },
            {
              "Pass": {
                "step": 3,
                "description": "Execute true command",
                "requirement": "TEST_SUCCESS",
                "item": 1,
                "tc": 1
              }
            }
          ],
          "all_steps_passed": true,
          "requirement": "TEST_SUCCESS",
          "item": 1,
          "tc": 1
        }
      ],
      "total_steps": 3,
      "passed_steps": 3,
      "failed_steps": 0,
      "not_executed_steps": 0,
      "overall_pass": true,
      "requirement": "TEST_SUCCESS",
      "item": 1,
      "tc": 1
    }
  ],
  "metadata": {
    "environment": "Development",
    "platform": "Linux x86_64",
    "executor": "Local Development",
    "execution_duration": 0.0,
    "total_test_cases": 1,
    "passed_test_cases": 1,
    "failed_test_cases": 0
  }
}